{
  "schema_version": "1.0.0",
  "astrazit_work_id": "AST-WRK-000002",
  "canonical_title": "Fictional Midnight Drift",
  "catalog_origin": "NATIVE",
  "lifecycle_status": "ACTIVE",
  "composition_rights": {
    "approval_status": "APPROVED",
    "approved_by": "fictional-rights-lead",
    "approved_at": "2026-09-08T12:00:00Z",
    "copyright_notice_composition": "(C) 2026 AstraZit Music Publishing",
    "writers": [
      {
        "name": "Fictional Composer A",
        "role": "COMPOSER",
        "percentage": 50.0,
        "ipi_cae": "111222333",
        "pro": "BMI"
      },
      {
        "name": "Fictional Author B",
        "role": "AUTHOR",
        "percentage": 50.0,
        "ipi_cae": "222333444",
        "pro": "ASCAP"
      }
    ],
    "publishers": [
      {
        "name": "AstraZit Publishing",
        "role": "PUBLISHER",
        "percentage": 100.0,
        "pro": "ASCAP"
      }
    ],
    "registrations": {
      "pro_registrations": [
        {
          "organization": "ASCAP",
          "status": "REGISTERED",
          "work_id": "ASCAP-000002",
          "registered_at": "2026-09-08T12:30:00Z"
        }
      ]
    }
  },
  "provenance": {
    "source": "HUMAN_ENTERED",
    "source_system": "catalog_admin_portal",
    "generated_at": "2026-09-08T10:00:00Z",
    "approval_status": "APPROVED",
    "approver": "fictional-rights-lead",
    "approved_at": "2026-09-08T12:00:00Z",
    "version": 1,
    "canonical_status": "MASTER_METADATA",
    "notes": " Fictional fixture only: no real ownership, approvals, catalog allocations, or assets are asserted."
  }
}
